{
  "kind": "EvaluationPack",
  "metadata": {
    "pack_id": "policy-review-specialist",
    "version": "0.1.0"
  },
  "capability_ref": "policy-review-specialist@0.1.0",
  "release_gate": {
    "status": "passed",
    "benchmark_pass_rate": 0.96,
    "minimum_benchmark_pass_rate": 0.95
  },
  "datasets": [
    {
      "dataset_id": "golden-account-freeze",
      "path": "datasets/golden-account-freeze.jsonl",
      "role": "release_gate"
    }
  ]
}
